{
  "schema_version": "1.0",
  "review_id": "cr-f383e41c3da14434b6ae421ed9094685",
  "version": 1,
  "created_at": "2026-10-16T23:37:26+11:00",
  "updated_at": "2026-10-16T23:37:26+11:00",
  "as_of": "2026-10-15",
  "status": "Awaiting Human Review",
  "status_reason": "High-severity finding requires human escalation decision",
  "document": {
    "source_name": "conflict.txt",
    "sha256": "490bba9c3c86070c8d7432648b918c469d35eda4ce494eff179e03169791cc07",
    "format": "txt",
    "page_count": 1,
    "extraction_mode": "text"
  },
  "consented_at": "2026-10-16T23:37:26+11:00",
  "fields": {
    "address": {
      "value": "虚构示例楼 6 号房（不存在的地址）",
      "confidence": 0.9,
      "evidence": {
        "source_name": "conflict.txt",
        "page": 1,
        "line": 4,
        "quote": "Address: 虚构示例楼 6 号房（不存在的地址）"
      }
    },
    "landlord": {
      "value": "Example Housing Pty Ltd",
      "confidence": 0.9,
      "evidence": {
        "source_name": "conflict.txt",
        "page": 1,
        "line": 2,
        "quote": "Landlord: Example Housing Pty Ltd"
      }
    },
    "tenant": {
      "value": "Alex Student",
      "confidence": 0.9,
      "evidence": {
        "source_name": "conflict.txt",
        "page": 1,
        "line": 3,
        "quote": "Tenant: Alex Student"
      }
    },
    "rent_amount": {
      "value": 650.0,
      "confidence": 0.9,
      "evidence": {
        "source_name": "conflict.txt",
        "page": 1,
        "line": 5,
        "quote": "Weekly rent: $650 per person"
      }
    },
    "rent_period": {
      "value": "week",
      "confidence": 0.9,
      "evidence": {
        "source_name": "conflict.txt",
        "page": 1,
        "line": 5,
        "quote": "Weekly rent: $650 per person"
      }
    },
    "rent_scope": {
      "value": "per_person",
      "confidence": 0.9,
      "evidence": {
        "source_name": "conflict.txt",
        "page": 1,
        "line": 5,
        "quote": "Weekly rent: $650 per person"
      }
    },
    "currency": {
      "value": "AUD",
      "confidence": 0.8,
      "evidence": {
        "source_name": "conflict.txt",
        "page": 1,
        "line": 5,
        "quote": "Weekly rent: $650 per person"
      }
    },
    "bond": {
      "value": 2000.0,
      "confidence": 0.9,
      "evidence": {
        "source_name": "conflict.txt",
        "page": 1,
        "line": 6,
        "quote": "Bond: $2000"
      }
    },
    "start_date": {
      "value": "2027-02-01",
      "confidence": 0.9,
      "evidence": {
        "source_name": "conflict.txt",
        "page": 1,
        "line": 7,
        "quote": "Start date: 2027-02-01"
      }
    },
    "end_date": {
      "value": "2028-01-31",
      "confidence": 0.9,
      "evidence": {
        "source_name": "conflict.txt",
        "page": 1,
        "line": 8,
        "quote": "End date: 2028-01-31"
      }
    },
    "signed_date": {
      "value": "2026-10-15",
      "confidence": 0.9,
      "evidence": {
        "source_name": "conflict.txt",
        "page": 1,
        "line": 9,
        "quote": "Date signed: 2026-10-15"
      }
    }
  },
  "additional_clauses": [
    {
      "text": "Special condition: Tenant and landlord should check the original agreement for the full wording.",
      "evidence": {
        "source_name": "conflict.txt",
        "page": 1,
        "line": 10,
        "quote": "Special condition: Tenant and landlord should check the original agreement for the full wording."
      }
    }
  ],
  "extraction_confidence": 0.9,
  "selection_evidence": {
    "schema_version": "1.0",
    "data_mode": "synthetic_demo",
    "recipient": "ContractAgent",
    "handoff_status": "prepared_not_sent",
    "recommendation_run_id": "rr-972d841d19dd56e4e14f57beaedf2bcdaaab6a1981a7d0962b1d3785a6a9d603",
    "selection_check_run_id": "rr-6c467d46870be59b3481cf8c15ee9cd30a39c9926895d1648c54727c08f2bfe8",
    "dataset_fingerprint": "32c38e031a258ef5e973d9e25bc8a59e0296cf91f9d402bdc7bfca3fa57acc20",
    "profile_fingerprint": "ea5f4046e0f804ef33d9fb2227947c61bca8d7a9715d776cc9ea44a62b66e352",
    "search_id": "DEMO-SEARCH-INTEGRATION-001",
    "profile_version": 1,
    "listing_id": "DEMO-006",
    "selected_at": "2026-09-17T10:00:00+10:00",
    "user_confirmed": true,
    "profile": {
      "schema_version": "1.0",
      "search_id": "DEMO-SEARCH-INTEGRATION-001",
      "profile_version": 1,
      "budget": {
        "currency": "AUD",
        "period": "week",
        "scope": "per_person",
        "includes_bills": true,
        "preferred": 450,
        "maximum": 550,
        "hard_limit": true
      },
      "occupants": 1,
      "rental_mode": "private_room",
      "destination_id": "demo-usyd",
      "arrival_time": "09:00",
      "timezone": "Australia/Sydney",
      "commute": {
        "modes": [
          "public_transport",
          "walk"
        ],
        "preferred_minutes": 25,
        "maximum_minutes": 40,
        "hard_limit": true
      },
      "move_in_window": {
        "from": "2027-02-01",
        "to": "2027-02-07"
      },
      "lease_months": 12,
      "hard_requirements": [
        "private_bedroom"
      ],
      "soft_preferences": {
        "furnished": 0.6,
        "private_bathroom": 0.4
      },
      "weights": {
        "commute": 0.35,
        "cost": 0.3,
        "housing": 0.2,
        "amenities": 0.15
      }
    },
    "listing_snapshot": {
      "listing_id": "DEMO-006",
      "source": "synthetic-fixture",
      "source_listing_id": "fixture-6",
      "data_kind": "synthetic",
      "fixture_category": "complete",
      "description": "虚构课程样本，非真实在租房源。",
      "listing_status": "active",
      "source_permission": true,
      "last_checked_at": "2026-09-17T08:00:00+10:00",
      "rental_mode": "private_room",
      "address": "虚构示例楼 6 号房（不存在的地址）",
      "suburb": "DEMO-SYDNEY",
      "postcode": "2000",
      "location_precision": "building",
      "rent_amount": 500,
      "rent_period": "week",
      "rent_scope": "per_person",
      "currency": "AUD",
      "bills_included": true,
      "bills_weekly": null,
      "mandatory_fees_weekly": 0,
      "private_bedroom": true,
      "private_bathroom": true,
      "furnished": true,
      "available_from": "2027-02-01",
      "latest_start_date": "2027-02-07",
      "minimum_lease_months": 6,
      "commute": {
        "duration_minutes": 25,
        "destination_id": "demo-usyd",
        "arrival_time": "09:00",
        "timezone": "Australia/Sydney",
        "mode": "public_transport",
        "queried_at": "2026-09-17T08:00:00+10:00",
        "data_kind": "synthetic",
        "walking_minutes": 5,
        "transfers": 0
      },
      "supermarket_distance_m": 400,
      "conflicts": [],
      "evidence": {
        "listing_id": {
          "source_ref": "fixture:DEMO-006#listing_id",
          "observed_at": "2026-09-17T08:00:00+10:00",
          "data_kind": "synthetic"
        },
        "source": {
          "source_ref": "fixture:DEMO-006#source",
          "observed_at": "2026-09-17T08:00:00+10:00",
          "data_kind": "synthetic"
        },
        "source_listing_id": {
          "source_ref": "fixture:DEMO-006#source_listing_id",
          "observed_at": "2026-09-17T08:00:00+10:00",
          "data_kind": "synthetic"
        },
        "data_kind": {
          "source_ref": "fixture:DEMO-006#data_kind",
          "observed_at": "2026-09-17T08:00:00+10:00",
          "data_kind": "synthetic"
        },
        "fixture_category": {
          "source_ref": "fixture:DEMO-006#fixture_category",
          "observed_at": "2026-09-17T08:00:00+10:00",
          "data_kind": "synthetic"
        },
        "description": {
          "source_ref": "fixture:DEMO-006#description",
          "observed_at": "2026-09-17T08:00:00+10:00",
          "data_kind": "synthetic"
        },
        "listing_status": {
          "source_ref": "fixture:DEMO-006#listing_status",
          "observed_at": "2026-09-17T08:00:00+10:00",
          "data_kind": "synthetic"
        },
        "source_permission": {
          "source_ref": "fixture:DEMO-006#source_permission",
          "observed_at": "2026-09-17T08:00:00+10:00",
          "data_kind": "synthetic"
        },
        "last_checked_at": {
          "source_ref": "fixture:DEMO-006#last_checked_at",
          "observed_at": "2026-09-17T08:00:00+10:00",
          "data_kind": "synthetic"
        },
        "rental_mode": {
          "source_ref": "fixture:DEMO-006#rental_mode",
          "observed_at": "2026-09-17T08:00:00+10:00",
          "data_kind": "synthetic"
        },
        "address": {
          "source_ref": "fixture:DEMO-006#address",
          "observed_at": "2026-09-17T08:00:00+10:00",
          "data_kind": "synthetic"
        },
        "suburb": {
          "source_ref": "fixture:DEMO-006#suburb",
          "observed_at": "2026-09-17T08:00:00+10:00",
          "data_kind": "synthetic"
        },
        "postcode": {
          "source_ref": "fixture:DEMO-006#postcode",
          "observed_at": "2026-09-17T08:00:00+10:00",
          "data_kind": "synthetic"
        },
        "location_precision": {
          "source_ref": "fixture:DEMO-006#location_precision",
          "observed_at": "2026-09-17T08:00:00+10:00",
          "data_kind": "synthetic"
        },
        "rent_amount": {
          "source_ref": "fixture:DEMO-006#rent_amount",
          "observed_at": "2026-09-17T08:00:00+10:00",
          "data_kind": "synthetic"
        },
        "rent_period": {
          "source_ref": "fixture:DEMO-006#rent_period",
          "observed_at": "2026-09-17T08:00:00+10:00",
          "data_kind": "synthetic"
        },
        "rent_scope": {
          "source_ref": "fixture:DEMO-006#rent_scope",
          "observed_at": "2026-09-17T08:00:00+10:00",
          "data_kind": "synthetic"
        },
        "currency": {
          "source_ref": "fixture:DEMO-006#currency",
          "observed_at": "2026-09-17T08:00:00+10:00",